image,caption
1.png,client management crm software tool .
1.png,contacts and invoicing management software tool .
1.png,accounting business process automation software tool .
2.png,99 designs logo designing service with price mentioned .
2.png,99 designs custom logo designing service .
2.png,logo design hub 99 designs .
3.png,holini google ads management service .
3.png,holini google ads marketing tool .
3.png,holini google ad marketing software .
4.png,ableton software products discount minimal .
4.png,ableton minimal design limited time discount .
4.png,Ableton 25% discount software .
5.png,adespresso facebook ads software .
5.png,adespresso ad creation software tool free trial .
5.png,Adespresso 14 day free trial software ad creation .
6.png,adespresso free ebook download facebook ads .
6.png,adespresso ebook free marketing tips .
6.png,adespresso marketing guide free ebook .
7.png,adidas new collection women training .
7.png,adidas fitness apparel new women collection .
7.png,adidas apparel women new collection .
8.png,adidas shoes lucky draw green and white new york .
8.png,adidas sneakers shoes lucky draw new york .
8.png,adidas lucky draw on sneakers or shoes .
9.png,adobe stock photos stunning nature image .
9.png,adobe nature image stunning stock images .
9.png,adobe stock images nature waterfall .
10.png,adstage free trial facebook ads software .
10.png,Adstage 14 day free trial ad management software tool .
10.png,adstage software tool free trial on marketing software .
11.png,adstage free webinar lead generation .
11.png,adstage webinar marketing ads tool leads .
11.png,adstage lead capture webinar .
12.png,artifact photo album ecommerce company .
12.png,artifact memoir ecommerce album .
12.png,artifact tokyo album ecommerce .
13.png,ahrefs google seo listing guide .
13.png,ahrefs google page listing SEO tool .
13.png,ahrefs page ranking tool .
14.png,airbnb woman nature green trees .
14.png,airbnb stunning imgery gree nature .
14.png,airbnb stunning image of nature .
15.png,airbnb inspirational travel .
15.png,airbnb travel suggestive ad .
15.png,airbnb travel hotel luxury .
16.png,alexa google seo listing guide .
16.png,alexa google page listing SEO tool .
16.png,alexa page ranking tool .
17.png,allsaints sale 50% 20% offsimple .
17.png,allsaints apparel sale .
17.png,allsaints sale on apparel products 50% off .
18.png,allsains limited time sale .
18.png,allsaints limited time offer 20% discount .
18.png,Allsaints 20% discount sale .
19.png,amazon prime day free trial .
19.png,amazon free trial of amazon prime service .
19.png,amazon free trial prime day 30 days .
20.png,amazon panda product recommendation .
20.png,amazon prduct recommendation .
20.png,amazon personalized ad product .
21.png,amazon prime now sale 50% dscount .
21.png,amazon prime now sale weekend limited stock .
21.png,amazon limited stock sale 50% off .
22.png,app academy upskilling platform .
22.png,app academy job platform inspirational .
22.png,app academy inspirational job switching .
23.png,appexchange customer feedback softwre tool .
23.png,appexchange software product .
23.png,appexchange software product customer feedback .
24.png,appsumo limited time offer software products .
24.png,Appsumo 90% discout software products .
24.png,appsumo discount limited time .
25.png,artifact custoemr testimonial review images .
25.png,artifact straw hat customer testimonial review .
25.png,artifact review from customer .
26.png,asana software product free trial .
26.png,asana free trial on software management product SAAS .
26.png,asana SAAS software free trial .
27.png,asana free trial software product SAAS .
27.png,asana task management software product SAAS .
27.png,asana software free tial .
28.png,asana free trial on software management product SAAS .
28.png,asana SAAS free trial software .
28.png,asana trak management free trial .
29.png,asana customer review doodles .
29.png,asana testimonial doodles .
29.png,asana customer testimonial SAAS doodles .
30.png,asos footwear shoes minimal sale .
30.png,asos footwear shoesclean white ad Sale .
30.png,asaos sale footwear shoes .
31.png,autopilot free trial software SAAS
31.png,autopilot free software SAAS
31.png,autopilot free trial software tool
32.png,aweber quiz software product
32.png,aweber software product quiz SAAS
32.png,aweber software emailing SAAS tool
33.png,Ben&jerry canabis special ad
33.png,Ben&jerry special ad canabis
33.png,Ben&jerry canabis special ad
34.png,Ben&jerry NGO local issue ad
34.png,Ben&jerry NGO local issue ad
34.png,Ben&jerry NGO local issue ad
35.png,Ben&jerry NGO local issue ad
35.png,Ben&jerry NGO local issue ad
35.png,Ben&jerry NGO local issue ad
36.png,ben&jerry icecream ecommerce products
36.png,ben&jerry ecommerce product icecream food
36.png,ben&jerry icecream food ecommerce
37.png,bestselfco ecommerce physical product cards
37.png,beselfco physical products cards ecommerce
37.png,bestselfco ecommerce cards sold
38.png,billabong nature water surfing ecofriendly ecommerce product
38.png,billabong physical ecommerce product
38.png,billabong water ecommerce nature ad
39.png,bille ecommerce grooming beauty
39.png,bille beauty products ecommerce
39.png,bille ecommerce physical products
40.png,bloomberg new update platform
40.png,bloomberg platform to get news
40.png,bloomberg platform for news